{
  "schema_version": 3,
  "run_mode": "inline",
  "run_scope": "selected_lenses",
  "target_path": "reviews/examples/artifacts/target.valid.md",
  "target_revision": "git:73eaed921475be235f6684abdd2ce19a4e367c7f",
  "claim_flags": {
    "completion": false,
    "lock_state": false,
    "all_5_lockable": false,
    "review_complete": false
  },
  "summary_text": "Inline LensTemper-style review\nNot independently reviewed\nNo spawned reviewers used\nScores are advisory, not lockable\n"
}
